id,label,original_text,text_ru,scenario,signals,difficulty,source,original_language,language,translation_type,modality
kaggle_safe_001,safe,"[Greetings], this is [Company] Utilities. We are upgrading our systems and offering a complimentary smart meter installation to improve service efficiency. Can we schedule a visit to your home this week? The appointment takes around 20 minutes, and there is no cost involved.","Здравствуйте, это [Компания] Utilities. Мы обновляем наши системы и предлагаем бесплатную установку умного счетчика для повышения качества обслуживания. Можем запланировать визит к вам домой на этой неделе? Установка займет около 20 минут и ничего не стоит.",utility_service_visit,,medium,kaggle_scam_non_scam,en,ru,manual_translated,text
kaggle_safe_002,safe,"[Greetings], this is [Company] Pharmacy. Your prescription for [Product] is up for a refill. Would you like us to auto-renew it or arrange a pickup? We also noticed you are eligible for a discount on your next purchase—shall we apply it?","Здравствуйте, это [Компания] Pharmacy. Ваш рецепт на [Товар] пора продлить. Хотите, чтобы мы продлили его автоматически или подготовили к выдаче? Мы также заметили, что вам доступна скидка на следующую покупку — применить ее?",pharmacy_refill,,easy,kaggle_scam_non_scam,en,ru,manual_translated,text
kaggle_safe_003,safe,"[Greetings], this is [Company] Medical Clinic. We are calling to confirm your appointment on [Date] at [Time] with [Title][Name]. If you need assistance with transportation or rescheduling, let us know—We are happy to help.","Здравствуйте, это [Компания] Medical Clinic. Звоним, чтобы подтвердить ваш прием [Дата] в [Время] у [Должность][Имя]. Если вам нужна помощь с транспортом или переносом записи, сообщите нам — мы с радостью поможем.",doctor_appointment,,easy,kaggle_scam_non_scam,en,ru,manual_translated,text
kaggle_safe_004,safe,"[Greetings], this is [Company] Retail. Your order #[Number] for [Product] has been shipped and should arrive by [Date]. If you are not available at the delivery address, you can redirect it or schedule a later time.","Здравствуйте, это [Компания] Retail. Ваш заказ №[Номер] на [Товар] отправлен и должен прибыть к [Дата]. Если вас не будет по адресу доставки, вы можете перенаправить заказ или выбрать более позднее время.",order_delivery_update,,easy,kaggle_scam_non_scam,en,ru,manual_translated,text
kaggle_safe_005,safe,"[Greetings], this is [Company] Bank. We are calling to verify recent transactions on your account ending in [Number]. It is a routine security check—no action is required unless something looks unusual. Would you like to set up transaction alerts for better tracking?","Здравствуйте, это [Компания] Bank. Мы звоним, чтобы уточнить недавние операции по вашему счету, оканчивающемуся на [Номер]. Это обычная проверка безопасности — никаких действий не требуется, если вас ничего не смущает. Хотите подключить уведомления об операциях для удобного контроля?",bank_routine_security_check,,medium,kaggle_scam_non_scam,en,ru,manual_translated,text
kaggle_safe_006,safe,"[Greetings], this is [Company] Library. Your borrowed book “[Product]” is due soon. You can return it at any branch or extend the due date online. We also have new arrivals in your preferred genre—would you like a recommendation?","Здравствуйте, это [Компания] Library. Срок возврата книги «[Товар]», которую вы взяли, скоро истекает. Вы можете вернуть ее в любом филиале или продлить срок онлайн. У нас также появились новинки в вашем любимом жанре — хотите рекомендацию?",library_due_notice,,easy,kaggle_scam_non_scam,en,ru,manual_translated,text
kaggle_safe_007,safe,"[Greetings], this is [Company] Auto Service. Your vehicle is due for scheduled maintenance. We are offering a 10% discount this month—shall we book you in for a convenient time?","Здравствуйте, это [Компания] Auto Service. Вашему автомобилю пора пройти плановое обслуживание. В этом месяце у нас действует скидка 10% — записать вас на удобное время?",auto_service_reminder,,easy,kaggle_scam_non_scam,en,ru,manual_translated,text
kaggle_safe_008,safe,"[Greetings], this is [Company] School. We are reminding you about the upcoming parent-teacher meeting on [Date]. Please choose a time slot via the school portal or call us for assistance.","Здравствуйте, это [Компания] School. Напоминаем о предстоящей встрече родителей с учителями [Дата]. Пожалуйста, выберите удобный слот через школьный портал или позвоните нам, если нужна помощь.",school_meeting_reminder,,easy,kaggle_scam_non_scam,en,ru,manual_translated,text
kaggle_safe_009,safe,"[Greetings], this is [Company] Airlines. Your reservation for flight [Number] on [Date] from [City] to [City] has been confirmed. Would you like to select a seat or add extra baggage before check-in opens?","Здравствуйте, это [Компания] Airlines. Ваше бронирование на рейс [Номер] от [Дата] из [Город] в [Город] подтверждено. Хотите заранее выбрать место или добавить багаж до открытия регистрации?",airline_reservation_confirmation,,easy,kaggle_scam_non_scam,en,ru,manual_translated,text
kaggle_safe_010,safe,"[Greetings], this is [Company] Solutions. Thank you for applying for the [Title] position. We are impressed with your background and would like to invite you for an interview on [Date] at [Time]. Would you prefer a virtual or in-person meeting?","Здравствуйте, это [Компания] Solutions. Спасибо за отклик на вакансию [Должность]. Нам понравился ваш опыт, и мы хотели бы пригласить вас на собеседование [Дата] в [Время]. Вам удобнее онлайн-встреча или очное интервью?",job_interview_invitation,,medium,kaggle_scam_non_scam,en,ru,manual_translated,text
kaggle_safe_011,safe,"[Greetings], this is [Company] Dental Care. We are reminding you that your routine dental cleaning is due. Would you like to book an appointment with [Title][Name] sometime next week? Evening slots are available.","Здравствуйте, это [Компания] Dental Care. Напоминаем, что вам пора пройти плановую чистку зубов. Хотите записаться к [Должность][Имя] на следующей неделе? Есть вечерние слоты.",doctor_appointment,,easy,kaggle_scam_non_scam,en,ru,manual_translated,text
kaggle_safe_012,safe,"[Greetings], this is [Company] Tech Support. We noticed a software update is pending on your device. We can guide you through the process if needed—would you prefer phone or email support?","Здравствуйте, это [Компания] Tech Support. Мы заметили, что на вашем устройстве ожидает установка обновление программного обеспечения. При необходимости мы можем провести вас по шагам — вам удобнее помощь по телефону или по электронной почте?",tech_support_guidance,,medium,kaggle_scam_non_scam,en,ru,manual_translated,text
kaggle_safe_013,safe,"[Greetings], this is [Company] Vet Clinic. We are checking in on [Name]'s annual check-up. We also have new wellness packages available for pets—shall we email the details to you?","Здравствуйте, это [Компания] Vet Clinic. Напоминаем о ежегодном осмотре для [Имя]. У нас также появились новые программы ухода за питомцами — отправить подробности вам на почту?",vet_checkup_reminder,,easy,kaggle_scam_non_scam,en,ru,manual_translated,text
kaggle_safe_014,safe,"[Greetings], this is [Company] Courier Services. A parcel addressed to [Name] will be delivered today between 3:00–5:00 PM. Would you like us to leave it at your doorstep if you are unavailable?","Здравствуйте, это [Компания] Courier Services. Посылка на имя [Имя] будет доставлена сегодня с 15:00 до 17:00. Если вас не будет дома, оставить ее у двери?",courier_delivery_notice,,medium,kaggle_scam_non_scam,en,ru,manual_translated,text
kaggle_safe_015,safe,"[Greetings], this is [Company] University Admissions. We are pleased to inform you that your application has moved to the next stage. Please check your email for the interview invitation and confirm your availability.","Здравствуйте, это [Компания] University Admissions. Рады сообщить, что ваша заявка перешла на следующий этап. Пожалуйста, проверьте электронную почту: там приглашение на интервью и просьба подтвердить вашу доступность.",admissions_update,,medium,kaggle_scam_non_scam,en,ru,manual_translated,text
kaggle_safe_016,safe,"[Greetings], this is [Company] Travel Desk. You had shown interest in the [Product] travel package. We have a promotion running until [Date]. Would you like us to hold a spot for you?","Здравствуйте, это [Компания] Travel Desk. Ранее вы интересовались туристическим пакетом [Товар]. У нас действует акция до [Дата]. Хотите, чтобы мы временно забронировали для вас место?",travel_promo_followup,,medium,kaggle_scam_non_scam,en,ru,manual_translated,text
kaggle_safe_017,safe,"[Greetings], this is [Company] Wellness Centre. Your fitness class with [Title][Name] is scheduled for tomorrow at 7:00 AM. Please bring your ID and arrive 10 minutes early to check in.","Здравствуйте, это [Компания] Wellness Centre. Ваше занятие по фитнесу с [Должность][Имя] назначено на завтра на 7:00 утра. Пожалуйста, возьмите удостоверение личности и приходите за 10 минут до начала для регистрации.",wellness_class_reminder,,easy,kaggle_scam_non_scam,en,ru,manual_translated,text
kaggle_safe_018,safe,"[Greetings], this is [Company] Insurance. Your policy renewal is approaching. Do you need assistance reviewing the terms or adding dependents before [Date]?","Здравствуйте, это [Компания] Insurance. Приближается дата продления вашего полиса. Нужна помощь с просмотром условий или добавлением зависимых лиц до [Дата]?",insurance_policy_renewal,,medium,kaggle_scam_non_scam,en,ru,manual_translated,text
kaggle_safe_019,safe,"[Greetings], this is [Company] HR Department. Your onboarding session is scheduled for [Date] at [Time]. Please bring your identification documents and signed offer letter.","Здравствуйте, это [Компания] HR Department. Ваша вводная сессия назначена на [Дата] в [Время]. Пожалуйста, возьмите с собой документы, удостоверяющие личность, и подписанное предложение о работе.",onboarding_session_reminder,,easy,kaggle_scam_non_scam,en,ru,manual_translated,text
kaggle_safe_020,safe,"[Greetings], this is [Company] Bookstore. Your pre-order for “[Product]” is ready for pickup. Would you like us to reserve a copy under your name until [Date]?","Здравствуйте, это [Компания] Bookstore. Ваш предзаказ на «[Товар]» готов к выдаче. Хотите, чтобы мы придержали экземпляр на ваше имя до [Дата]?",preorder_pickup_notice,,easy,kaggle_scam_non_scam,en,ru,manual_translated,text
kaggle_safe_021,safe,"[Greetings], this is [Company] Internet Services. We are performing maintenance in your area on [Date] from [Time]. Services may be briefly interrupted. Thank you for your understanding.","Здравствуйте, это [Компания] Internet Services. [Дата] с [Время] мы проводим технические работы в вашем районе. Возможны кратковременные перебои в работе сервиса. Спасибо за понимание.",internet_maintenance_notice,,easy,kaggle_scam_non_scam,en,ru,manual_translated,text
kaggle_safe_022,safe,"[Greetings], this is [Company] Housing Services. We are following up on your maintenance request. Our technician will arrive on [Date] between [Time] to inspect the issue.","Здравствуйте, это [Компания] Housing Services. Мы связываемся с вами по вашей заявке на обслуживание. Наш специалист приедет [Дата] в промежутке [Время], чтобы осмотреть проблему.",housing_maintenance_followup,,easy,kaggle_scam_non_scam,en,ru,manual_translated,text
kaggle_safe_023,safe,"[Greetings], this is [Company] Streaming Support. We noticed you are having playback issues on your [Product]. Would you like us to walk you through resetting your device?","Здравствуйте, это [Компания] Streaming Support. Мы заметили, что у вас есть проблемы с воспроизведением на вашем [Товар]. Хотите, чтобы мы пошагово объяснили, как перезагрузить устройство?",technical_support_guidance,,medium,kaggle_scam_non_scam,en,ru,manual_translated,text
kaggle_safe_024,safe,"[Greetings], this is [Company] Mobile Network. A new SIM card upgrade is available at no cost. You can collect it from any outlet or request delivery. Would you prefer home service?","Здравствуйте, это [Компания] Mobile Network. Для вас доступно бесплатное обновление SIM-карты. Ее можно забрать в любом офисе или заказать доставку. Вам удобнее обслуживание на дому?",mobile_service_upgrade,,medium,kaggle_scam_non_scam,en,ru,manual_translated,text
kaggle_safe_025,safe,"[Greetings], this is [Company] Events Team. You RSVP would for our webinar on “[Product] Trends in 2025.” Just a reminder—it begins on [Date] at [Time]. Need a calendar invite?","Здравствуйте, это [Компания] Events Team. Вы зарегистрировались на наш вебинар «Тренды [Товар] в 2025 году». Напоминаем: он начнется [Дата] в [Время]. Нужна ссылка-приглашение в календарь?",webinar_reminder,,easy,kaggle_scam_non_scam,en,ru,manual_translated,text
kaggle_safe_026,safe,"[Greetings], this is [Company] Gym. We have noticed you have not checked in recently. We are offering a 2-week fitness reactivation promo. Shall we reserve your spot in the next yoga class?","Здравствуйте, это [Компания] Gym. Мы заметили, что вы давно не посещали занятия. Сейчас у нас действует двухнедельная акция на возвращение в фитнес. Забронировать для вас место на ближайшем занятии по йоге?",fitness_reactivation_offer,,easy,kaggle_scam_non_scam,en,ru,manual_translated,text
kaggle_safe_027,safe,"[Greetings], this is [Company] Billing Department. Your invoice for [Product] has been generated and is due by [Date]. Would you like a digital copy sent via email?","Здравствуйте, это [Компания] Billing Department. Счет на [Товар] сформирован, и оплатить его нужно до [Дата]. Хотите, чтобы мы отправили электронную копию на почту?",billing_invoice_notice,,medium,kaggle_scam_non_scam,en,ru,manual_translated,text
kaggle_safe_028,safe,"[Greetings], this is [Company] Alumni Relations. We are organizing a virtual reunion for the class of [Year]. Would you like to participate and reconnect with [Name] and other classmates?","Здравствуйте, это [Компания] Alumni Relations. Мы организуем онлайн-встречу выпускников [Год] года. Хотите поучаствовать и пообщаться с [Имя] и другими однокурсниками?",alumni_reunion_invite,,easy,kaggle_scam_non_scam,en,ru,manual_translated,text
kaggle_safe_029,safe,"[Greetings], this is [Company] HR. We would like your feedback on your recent internal training on “[Product].” Your insights help improve our programs. The survey link is in your inbox.","Здравствуйте, это [Компания] HR. Нам важна ваша обратная связь по недавнему внутреннему обучению «[Товар]». Ваши ответы помогают улучшать наши программы. Ссылка на опрос уже у вас во входящих.",internal_training_feedback,,medium,kaggle_scam_non_scam,en,ru,manual_translated,text
kaggle_safe_030,safe,"[Greetings], this is [Company] Catering Services. We are confirming the menu for your event on [Date]. Would you like to finalize the guest count or make any last-minute changes?","Здравствуйте, это [Компания] Catering Services. Подтверждаем меню для вашего мероприятия [Дата]. Хотите уточнить количество гостей или внести последние изменения?",event_catering_confirmation,,easy,kaggle_scam_non_scam,en,ru,manual_translated,text
kaggle_safe_031,safe,"[Greetings], this is [Company] Airlines. Your flight reservation for flight [Number] on [Date] is confirmed. Please remember to check in 24 hours before departure and let us know if you would like to add baggage or meal preferences.","Здравствуйте, это [Компания] Airlines. Ваше бронирование на рейс [Номер] от [Дата] подтверждено. Пожалуйста, не забудьте пройти регистрацию за 24 часа до вылета и сообщите нам, если хотите добавить багаж или выбрать питание.",airline_reservation_confirmation,,easy,kaggle_scam_non_scam,en,ru,manual_translated,text
kaggle_fraud_001,fraud,"[Greetings] I am calling from the government grants department. You have been selected to receive a substantial grant for your business or personal use. However, we need your bank account information and a processing fee to complete the transfer.","Здравствуйте, я звоню из отдела государственных грантов. Вас выбрали для получения крупного гранта для бизнеса или личных целей. Однако для перевода средств нам нужны реквизиты вашего банковского счета и небольшой сбор за обработку выплаты.",fake_grant_fee_scam,"government_impersonation;card_data_request;pressure",easy,kaggle_scam_non_scam,en,ru,manual_translated,text
kaggle_fraud_002,fraud,"[Greetings], we are calling on behalf of a charitable organization. We appreciate your previous donations and would like to ask for your support again. Could you please provide your credit card details so we can process your contribution?","Здравствуйте, мы звоним от имени благотворительной организации. Мы ценим ваши прошлые пожертвования и хотели бы снова попросить вас о поддержке. Пожалуйста, продиктуйте данные вашей банковской карты, чтобы мы могли оформить взнос.",fake_charity_donation,"card_data_request;trust_building",easy,kaggle_scam_non_scam,en,ru,manual_translated,text
kaggle_fraud_003,fraud,"Congratulations! You have won a free vacation package to an exotic destination. To claim your prize, we require your credit card information for verification purposes. Do not miss this opportunity!","Поздравляем! Вы выиграли бесплатный туристический пакет в экзотическую страну. Чтобы получить приз, нам нужны данные вашей банковской карты якобы для верификации. Не упустите эту возможность!",prize_scam,"card_data_request;urgency",easy,kaggle_scam_non_scam,en,ru,manual_translated,text
kaggle_fraud_004,fraud,"[Greetings]. I am calling from the technical support team of [Company] . Our system has detected a virus on your computer, and we need remote access to fix it. Please provide your login credentials and credit card information to proceed.","Здравствуйте. Я звоню из службы технической поддержки [Компания]. Наша система обнаружила вирус на вашем компьютере, и нам нужен удаленный доступ, чтобы все исправить. Пожалуйста, сообщите логин, пароль и данные банковской карты для продолжения.",fake_support_app_install,"remote_access_app;password_request;card_data_request;trust_building",easy,kaggle_scam_non_scam,en,ru,manual_translated,text
kaggle_fraud_005,fraud,"[Greetings], this is [Title][Name]  from the local police department. We have identified suspicious activity related to your bank account. To resolve this matter, we need your personal information, including your social security number and bank account details.","Здравствуйте, это [Должность][Имя] из местного отделения полиции. Мы выявили подозрительную активность, связанную с вашим банковским счетом. Чтобы урегулировать ситуацию, нам нужны ваши личные данные, включая идентификационный номер и реквизиты счета.",fake_police_call,"police_impersonation;pressure;card_data_request",easy,kaggle_scam_non_scam,en,ru,manual_translated,text
kaggle_fraud_006,fraud,"[Greetings]  I am calling from your internet service provider. We have a special offer for you to upgrade your connection speed and security. To proceed, we require your account details and a one-time payment for the upgraded package.","Здравствуйте, я звоню от имени вашего интернет-провайдера. Для вас доступно специальное предложение по повышению скорости и безопасности подключения. Чтобы подключить пакет, нам нужны данные вашего аккаунта и разовый платеж.",fake_service_upgrade_scam,"card_data_request;pressure",medium,kaggle_scam_non_scam,en,ru,manual_translated,text
kaggle_fraud_007,fraud,"This is the electric company calling. We have noticed irregularities in your billing and suspect a malfunctioning meter. To rectify the issue, we need your credit card information or a direct payment over the phone.","Это звонок из энергокомпании. Мы заметили нарушения в начислениях и подозреваем неисправность счетчика. Чтобы урегулировать вопрос, нам нужны данные вашей карты или прямой платеж по телефону.",utility_billing_scam,"card_data_request;pressure;trust_building",medium,kaggle_scam_non_scam,en,ru,manual_translated,text
