id,label,original_text,text_ru,scenario,signals,difficulty,source,original_language,language,translation_type,modality
kaggle_fraud_008,fraud,"[Name], it is me! I am in trouble and need your help urgently. I have been involved in an accident and need money for medical expenses. Please do not tell anyone, but could you wire the funds to this account right away?","[Имя], это я! У меня беда, срочно нужна твоя помощь. Я попал в аварию и мне нужны деньги на лечение. Пожалуйста, никому не говори и немедленно переведи деньги на этот счет.",relative_emergency,"urgency;secrecy;pressure",easy,kaggle_scam_non_scam,en,ru,manual_translated,text
kaggle_fraud_009,fraud,"[Greetings]  this is your bank calling. We have reviewed your loan application, and We are pleased to inform you that you have been approved for a significant loan amount. However, we need an upfront fee to process the loan. Kindly share your bank account details to proceed. Or you can transfer the online payment to this bank account [Number].","Здравствуйте, это звонок из вашего банка. Мы рассмотрели вашу заявку на кредит и рады сообщить, что она одобрена на крупную сумму. Однако для выдачи кредита нужно сначала оплатить комиссию. Сообщите реквизиты счета или переведите оплату на этот банковский счет [Номер].",fake_loan_application,"bank_impersonation;loan_fraud;card_data_request;pressure",easy,kaggle_scam_non_scam,en,ru,manual_translated,text
kaggle_fraud_010,fraud,"[Greetings], this is the [Company]. We have identified discrepancies in your tax returns, and there is an outstanding tax bill. To avoid legal consequences, we require your immediate payment. Please provide your credit card information or make a wire transfer.","Здравствуйте, это [Компания]. Мы обнаружили несоответствия в вашей налоговой отчетности, и у вас есть задолженность по налогам. Чтобы избежать юридических последствий, требуется немедленная оплата. Пожалуйста, сообщите данные карты или сделайте банковский перевод.",fake_tax_collection,"government_impersonation;urgency;pressure;card_data_request",easy,kaggle_scam_non_scam,en,ru,manual_translated,text
kaggle_fraud_011,fraud,"[Greetings], this is [Name] your buddy from high school remember? Look, I am in a difficult situation and urgently need money. I have been robbed in an accident and need funds for medical treatment. Please wire the money to this account [Number] immediately. You are the only one I can trust on right now.","Привет, это [Имя], твой школьный друг, помнишь? Я в очень тяжелой ситуации и срочно нуждаюсь в деньгах. После аварии меня ограбили, и теперь нужны средства на лечение. Пожалуйста, немедленно переведи деньги на этот счет [Номер]. Сейчас я могу рассчитывать только на тебя.",friend_emergency_scam,"urgency;pressure;secrecy",medium,kaggle_scam_non_scam,en,ru,manual_translated,text
kaggle_fraud_012,fraud,"[Greetings], this is [Name] your buddy from high school remember? Look, I am in a difficult situation and urgently need money. I have been involved in an accident and need funds for medical treatment. Please wire the money to this account [Number] immediately. You are the only one I can rely on right now.","Привет, это [Имя], твой школьный друг, помнишь? Я оказался в сложной ситуации и срочно нуждаюсь в деньгах. Я попал в аварию, и мне нужны средства на лечение. Пожалуйста, немедленно переведи деньги на этот счет [Номер]. Сейчас я могу положиться только на тебя.",friend_emergency_scam,"urgency;pressure;secrecy",medium,kaggle_scam_non_scam,en,ru,manual_translated,text
kaggle_fraud_013,fraud,"[Greetings] I am calling from the Social Security Administration. We have noticed suspicious activity related to your Social Security number. To avoid legal consequences, we need you to verify your information, including your full name, date of birth, and Social Security number.","Здравствуйте, я звоню из службы социального страхования. Мы заметили подозрительную активность, связанную с вашим номером социального страхования. Чтобы избежать юридических последствий, вам нужно подтвердить свои данные, включая полное имя, дату рождения и идентификационный номер.",ssn_impersonation,"government_impersonation;pressure",easy,kaggle_scam_non_scam,en,ru,manual_translated,text
kaggle_fraud_014,fraud,"[Greetings]  We are calling about your vehicle's extended warranty. Our records show that your warranty is about to expire, and we can offer you an exclusive renewal. To proceed, we need your credit card information and vehicle details.","Здравствуйте, мы звоним по поводу продленной гарантии на ваш автомобиль. По нашим данным, срок гарантии скоро истекает, и мы можем предложить эксклюзивное продление. Для оформления нам нужны данные банковской карты и сведения об автомобиле.",vehicle_warranty_scam,"card_data_request;trust_building",medium,kaggle_scam_non_scam,en,ru,manual_translated,text
kaggle_fraud_015,fraud,"[Greetings], this is the refund department of [Company]. We apologize for the inconvenience caused by a previous service issue. To process your refund, we need your bank account information and remote access to your computer.","Здравствуйте, это отдел возвратов [Компания]. Приносим извинения за неудобства из-за прошлой проблемы с сервисом. Чтобы оформить возврат средств, нам нужны реквизиты вашего банковского счета и удаленный доступ к вашему компьютеру.",fake_refund_remote_access,"remote_access_app;card_data_request;trust_building",easy,kaggle_scam_non_scam,en,ru,manual_translated,text
kaggle_fraud_016,fraud,"[Greetings], this is your [Name] , and I am in trouble. I have been in an accident and need money for medical bills. Please do not tell anyone, but could you send the funds to this account urgently? Please transfer the payment to this bank account [Number].","Привет, это [Имя], у меня беда. Я попал в аварию, и срочно нужны деньги на лечение. Пожалуйста, никому не говори и срочно отправь средства на этот счет. Переведи деньги на этот банковский счет [Номер].",relative_emergency,"urgency;secrecy;pressure",easy,kaggle_scam_non_scam,en,ru,manual_translated,text
kaggle_fraud_017,fraud,"Congratulations! You have won a lottery or sweepstakes prize worth a significant amount of money. To claim your winnings, we require a small processing fee or your bank account details to facilitate the transfer.","Поздравляем! Вы выиграли крупный приз в лотерее или розыгрыше. Чтобы получить выигрыш, нужно оплатить небольшой сбор за обработку или сообщить реквизиты банковского счета для перевода.",lottery_fee_scam,"card_data_request;pressure",easy,kaggle_scam_non_scam,en,ru,manual_translated,text
kaggle_fraud_018,fraud,"[Greetings] this is a debt collection agency. You have an outstanding debt that needs immediate settlement. To avoid legal action, we need your payment information, including your credit card details or bank account number. Or you may transfer the payment to this bank account [Number].","Здравствуйте, это агентство по взысканию долгов. У вас есть непогашенная задолженность, которую нужно срочно оплатить. Чтобы избежать судебных мер, нам нужны платежные данные, включая реквизиты карты или номер банковского счета. Либо вы можете перевести деньги на этот счет [Номер].",debt_collection_scam,"urgency;pressure;card_data_request",easy,kaggle_scam_non_scam,en,ru,manual_translated,text
kaggle_fraud_019,fraud,"This is your internet service provider calling. We have detected a security breach in your router, and we need to update your network settings. Please provide your login credentials and other personal details for assistance.","Это звонок от вашего интернет-провайдера. Мы обнаружили нарушение безопасности в вашем роутере и должны обновить сетевые настройки. Для помощи сообщите логин, пароль и другие личные данные.",router_security_breach_scam,"password_request;trust_building;pressure",medium,kaggle_scam_non_scam,en,ru,manual_translated,text
kaggle_fraud_020,fraud,"[Greetings], we are calling on behalf of a charitable organization. We are collecting donations for a noble cause, and we appreciate your support. Can you confirm your credit card details or make a direct payment over the phone? Or you may transfer the payment to this bank account [Number].","Здравствуйте, мы звоним от имени благотворительной организации. Мы собираем пожертвования на благую цель и очень ценим вашу поддержку. Не могли бы вы подтвердить данные банковской карты или сделать оплату по телефону? Либо вы можете перевести деньги на этот банковский счет [Номер].",fake_charity_donation,"card_data_request;trust_building",easy,kaggle_scam_non_scam,en,ru,manual_translated,text
kaggle_fraud_021,fraud,"[Greetings] this is [Company]  calling. We have new benefits and services available for you. To update your information and access these benefits, we require your phone number and other personal details.","Здравствуйте, это [Компания]. Для вас доступны новые льготы и услуги. Чтобы обновить данные и получить доступ к этим преимуществам, нам нужен ваш номер телефона и другие личные сведения.",benefits_update_scam,"trust_building;pressure",medium,kaggle_scam_non_scam,en,ru,manual_translated,text
kaggle_fraud_022,fraud,"Congratulations! You have been selected for a lucrative job opportunity at [Company] . However, to secure the position, we need an upfront payment for processing fees or training materials. Please provide your payment information or you may transfer the payment to this bank account [Number].","Поздравляем! Вас выбрали на очень выгодную работу в [Компания]. Однако, чтобы закрепить место, нужно заранее оплатить комиссию за оформление или учебные материалы. Пожалуйста, сообщите платежные данные или переведите деньги на этот банковский счет [Номер].",fake_job_fee_scam,"pressure;card_data_request",easy,kaggle_scam_non_scam,en,ru,manual_translated,text
kaggle_fraud_023,fraud,"We are calling from a government grant agency. Due to an error in the system, you have received excess grant funds. To rectify this, we need your bank account details to process the refund.","Мы звоним из государственного агентства по грантам. Из-за ошибки в системе вам якобы были перечислены лишние средства. Чтобы урегулировать это, нам нужны реквизиты вашего банковского счета для оформления возврата.",fake_grant_refund_scam,"government_impersonation;card_data_request;trust_building",medium,kaggle_scam_non_scam,en,ru,manual_translated,text
kaggle_fraud_024,fraud,"Great news! You have won a luxury vacation package to an exotic destination. Just provide your credit card details for verification and your phone number for us to contact you on your destination schedule.","Отличные новости! Вы выиграли роскошный тур в экзотическую страну. Просто сообщите данные банковской карты для верификации и номер телефона, чтобы мы связались с вами по деталям поездки.",prize_scam,"card_data_request;trust_building",easy,kaggle_scam_non_scam,en,ru,manual_translated,text
kaggle_fraud_025,fraud,"[Greetings], this is [Name] from [Company]. Your social security number has been compromised. We need your personal details to secure your account. Please give us your full name, identity number and your age.","Здравствуйте, это [Имя] из [Компания]. Ваш идентификационный номер был скомпрометирован. Чтобы защитить вашу учетную запись, нам нужны ваши личные данные. Пожалуйста, назовите полное имя, номер документа и ваш возраст.",ssn_impersonation,"government_impersonation;pressure",medium,kaggle_scam_non_scam,en,ru,manual_translated,text
kaggle_fraud_026,fraud,"[Greetings], this is [Name] from [Company].Congratulations! You have been selected for a government grant. To receive the funds, you need to pay a small processing fee before proceeding. Please transfer the payment to this bank account [Number].","Здравствуйте, это [Имя] из [Компания]. Поздравляем! Вас выбрали для получения государственного гранта. Чтобы получить деньги, нужно сначала оплатить небольшой сбор за обработку. Пожалуйста, переведите платеж на этот банковский счет [Номер].",fake_grant_fee_scam,"government_impersonation;pressure",easy,kaggle_scam_non_scam,en,ru,manual_translated,text
kaggle_fraud_027,fraud,"[Greetings], this is [Name] from [Company].We are calling from [Company] bank to verify your account details. Please provide your bank account number, pin number and password.","Здравствуйте, это [Имя] из [Компания]. Мы звоним из банка [Компания], чтобы проверить данные вашего счета. Пожалуйста, назовите номер банковского счета, PIN-код и пароль.",bank_account_verification_scam,"bank_impersonation;password_request;card_data_request",easy,kaggle_scam_non_scam,en,ru,manual_translated,text
kaggle_fraud_028,fraud,"[Greetings], this is [Company]  calling to inform you that your computer license has expired. Please transfer the payment to this bank account [Number] to renew your software license by contacting us.","Здравствуйте, это [Компания]. Сообщаем, что срок действия лицензии на вашем компьютере истек. Пожалуйста, переведите оплату на этот банковский счет [Номер], чтобы продлить программную лицензию.",software_license_scam,"pressure",medium,kaggle_scam_non_scam,en,ru,manual_translated,text
kaggle_fraud_029,fraud,"Congratulations! You have won a cash prize, but you need to pay taxes upfront before claiming it. Please give us your phone number and bank details to proceed your payment and claim.","Поздравляем! Вы выиграли денежный приз, но перед получением нужно заранее оплатить налоги. Пожалуйста, сообщите нам свой номер телефона и банковские реквизиты, чтобы оформить платеж и выдачу.",prize_tax_scam,"pressure;card_data_request",easy,kaggle_scam_non_scam,en,ru,manual_translated,text
kaggle_fraud_030,fraud,"[Greetings], this is [Title][Name]. Wanna be rich? I am guiding my fans to make fast bucks with little effort. Invest in a once-in-a-lifetime opportunity with us. Our interest rate is low, and your profit is twice than you invest I guarantee. Send us your bank details and phone number now to secure your spot.","Здравствуйте, это [Должность][Имя]. Хотите быстро разбогатеть? Я помогаю своим подписчикам зарабатывать большие деньги с минимальными усилиями. Инвестируйте в уникальную возможность вместе с нами. Процент низкий, а прибыль будет вдвое больше вложений, я гарантирую. Отправьте банковские реквизиты и номер телефона прямо сейчас, чтобы занять место.",investment_scam,"pressure;trust_building;urgency",easy,kaggle_scam_non_scam,en,ru,manual_translated,text
